{
  "$schema": "https://zenodo.org/records/22133203/files/program-matematika-indonesia-catalog-v1.schema.json",
  "schemaVersion": 1,
  "snapshotDate": "2026-08-27",
  "sourceCommit": "6212337e077bf2fe16315ab47fd1d618a8c8c434",
  "program": {
    "id": "program-matematika-indonesia",
    "title": "Program Matematika Indonesia — Peta Kurikulum Terbuka",
    "language": "id-ID",
    "version": "0.59.0",
    "snapshotDate": "2026-08-27",
    "totalCourseRoles": 40,
    "selectedCorpusRoles": 40,
    "unresolvedRoleIds": [],
    "completedPublicCourseRoleIds": [
      "A00",
      "B10",
      "B40",
      "B60",
      "B80",
      "B90",
      "C10",
      "C30",
      "C40",
      "C60",
      "C70",
      "C80",
      "C100",
      "C110",
      "C120",
      "C130",
      "D20",
      "D110",
      "D120"
    ],
    "completedPublicRecordDois": [
      "10.5281/zenodo.22070683",
      "10.5281/zenodo.22060439",
      "10.5281/zenodo.22070458",
      "10.5281/zenodo.22053905",
      "10.5281/zenodo.22062144",
      "10.5281/zenodo.22105195",
      "10.5281/zenodo.22062449",
      "10.5281/zenodo.22052196",
      "10.5281/zenodo.22062005",
      "10.5281/zenodo.21932787",
      "10.5281/zenodo.22054086",
      "10.5281/zenodo.22070943",
      "10.5281/zenodo.22070653",
      "10.5281/zenodo.22088947",
      "10.5281/zenodo.22062017",
      "10.5281/zenodo.22102628",
      "10.5281/zenodo.22105443",
      "10.5281/zenodo.22073823"
    ],
    "website": "https://kokunoyumeto.github.io/program-matematika-indonesia/",
    "zenodo": "https://doi.org/10.5281/zenodo.22133203",
    "zenodoConcept": "https://doi.org/10.5281/zenodo.22059707",
    "provenance": {
      "model": "OpenAI Codex gpt-5.6-sol, Ultra",
      "role": "Koordinasi, rekayasa backend, dan penerbitan snapshot pusat atas instruksi pengguna; kredit sumber dan kontributor tetap melekat pada setiap komponen."
    },
    "backend": {
      "schemaVersion": "1.0.0",
      "status": "validated",
      "centralRecordCount": 2122,
      "completeCorpusMigrations": [
        {
          "corpus": "Discrete Mathematics: An Open Introduction 4 — Bahasa Indonesia",
          "recordCount": 163583,
          "result": "lossless-zero-copy-pass"
        },
        {
          "corpus": "Hefferon — Linear Algebra, Bahasa Indonesia v2026.08.22",
          "recordCount": 22131,
          "result": "lossless-zero-copy-one-to-one-native-backend-adapter-pass"
        },
        {
          "corpus": "Komputasi Matematis dan Eksperimen yang Dapat Direproduksi — Bahasa Indonesia",
          "recordCount": 339,
          "result": "lossless-zero-copy-one-to-one-native-catalog-adapter-pass"
        },
        {
          "corpus": "Open Logic Project — OLP-0722, Bahasa Indonesia",
          "recordCount": 6522,
          "result": "deterministic-zero-copy-pass"
        },
        {
          "corpus": "Judson — Abstract Algebra: Theory and Applications, Bahasa Indonesia",
          "recordCount": 36978,
          "result": "additive-zero-copy-pass"
        },
        {
          "corpus": "Yet Another Introductory Number Theory Textbook, Bahasa Indonesia",
          "recordCount": 6967,
          "result": "lossless-additive-adapter-pass"
        },
        {
          "corpus": "Keller–Trotter — Applied Combinatorics, Bahasa Indonesia",
          "recordCount": 19049,
          "result": "lossless-additive-one-common-record-per-native-record-pass"
        },
        {
          "corpus": "Mathematics in Lean — Bahasa Indonesia v4.30.0-id.3",
          "recordCount": 10978,
          "result": "lossless-zero-copy-one-to-one-pass"
        },
        {
          "corpus": "OpenStax Prealgebra 2e — Bahasa Indonesia v0.2.7",
          "recordCount": 523046,
          "result": "lossless-streaming-zero-copy-adapter-pass"
        },
        {
          "corpus": "Lega v1.01 — Pemodelan Matematis, Bahasa Indonesia",
          "recordCount": 16029,
          "result": "lossless-replayable-zero-copy-adapter-pass"
        },
        {
          "corpus": "Open Optimization Book 1 + laboratorium Pyomo/HiGHS O018, Bahasa Indonesia",
          "recordCount": 25805,
          "result": "lossless-zero-copy-one-to-one-plus-segment-variant-projection-pass"
        },
        {
          "corpus": "Tea Time Numerical Analysis — Bahasa Indonesia v3.0-id.2-r1",
          "recordCount": 53055,
          "result": "additive-zero-copy-virtual-adapter-pass"
        },
        {
          "corpus": "Erdman — Functional Analysis and Operator Algebras, Bahasa Indonesia",
          "recordCount": 41689,
          "result": "lossless-zero-copy-virtual-adapter-pass"
        }
      ],
      "schema": "https://zenodo.org/records/22133203/files/interlanguage-math-backend-v1.schema.json?download=1",
      "sourceFormatProfile": "https://zenodo.org/records/22133203/files/interlanguage-source-format-profile-v1.schema.json?download=1",
      "package": "https://zenodo.org/records/22133203/files/program-matematika-indonesia-backend-v1-v0.59.0.zip?download=1",
      "federationV2": {
        "version": "0.4.1",
        "status": "validated",
        "recordCount": 2478,
        "datasetCount": 34,
        "courseCount": 40,
        "learnerSurfaceCount": 154,
        "webRouteCount": 43,
        "identityCrosswalkCount": 2122,
        "package": "https://zenodo.org/records/22133203/files/program-matematika-indonesia-backend-v2-v0.59.0.zip?download=1",
        "packageSchema": "https://zenodo.org/records/22133203/files/federation-package-v2.schema.json?download=1",
        "recordSchema": "https://zenodo.org/records/22133203/files/federation-record-v2.schema.json?download=1",
        "validationReceipt": "https://zenodo.org/records/22133203/files/GLOBAL_BACKEND_V2_PHASE1_VALIDATION_RECEIPT_v0.59.0.json?download=1",
        "publicationEventCount": 67,
        "qaEventCount": 17
      },
      "learnerReadModelV1": {
        "version": "1.0.0",
        "status": "validated",
        "courseCount": 40,
        "prerequisiteEdgeCount": 82,
        "authority": "https://zenodo.org/records/22133203/files/curriculum-authority-v1.json?download=1",
        "authoritySchema": "https://zenodo.org/records/22133203/files/curriculum-authority-v1.schema.json?download=1",
        "readModel": "https://zenodo.org/records/22133203/files/learner-read-model-v1.json?download=1",
        "readModelSchema": "https://zenodo.org/records/22133203/files/learner-read-model-v1.schema.json?download=1",
        "validationReceipt": "https://zenodo.org/records/22133203/files/LOCAL_RELEASE_VALIDATION_v0.59.0.json?download=1",
        "publicEndpoint": "https://kokunoyumeto.github.io/program-matematika-indonesia/data/learner-read-model.json"
      },
      "federationV21": {
        "version": "2.1.0",
        "status": "pilot_validated",
        "pilot_courses": [
          "A00",
          "B10",
          "C100",
          "D20"
        ],
        "pilot_units": 1194,
        "pilot_relations": 2165,
        "route_wrapper_course": "D20",
        "route_wrapper_courses": [
          "C100",
          "D20"
        ],
        "educational_access_planning": {
          "schema_id": "interlanguage/global-backend-v2.1-educational-access-planning/0.1.0",
          "dataset_id": "planning:educational-access:v2.1:0.1.0",
          "status": "validated",
          "curriculum_unit_count": 29,
          "portfolio_count": 13,
          "portfolio_relation_count": 10,
          "adaptation_depth_count": 5,
          "accessibility_derivative_count": 8,
          "compute_assumption_count": 12,
          "compute_scenario_count": 3
        },
        "packageSchema": "https://zenodo.org/records/22133203/files/federation-unit-package-v2.1.schema.json?download=1",
        "recordSchema": "https://zenodo.org/records/22133203/files/federation-unit-record-v2.1.schema.json?download=1",
        "package": "https://zenodo.org/records/22133203/files/program-matematika-indonesia-backend-v2.1-pilots-v0.59.0.zip?download=1"
      },
      "educationalAccessResearch": {
        "version": "0.1.0",
        "status": "frozen_validated",
        "record_count": 490,
        "materialized_table_count": 10,
        "declared_unmaterialized_table_count": 7,
        "publicCatalog": "https://kokunoyumeto.github.io/program-matematika-indonesia/data/educational-access.json",
        "schema": "https://kokunoyumeto.github.io/program-matematika-indonesia/schema/educational-access-federation-v1.schema.json",
        "sourcePackage": "https://zenodo.org/records/22133203/files/program-matematika-indonesia-source-v0.59.0.zip?download=1"
      },
      "federationV22": {
        "version": "2.2.0",
        "status": "pilot_validated_zero_copy",
        "pilotCourseId": "A00",
        "packageId": "urn:uuid:023b0035-f385-5188-920b-2130aa61f815",
        "canonicalPackage": {
          "path": "backend/v2.2/packages/a00-openstax-prealgebra-v0.1.0",
          "fileCount": 36,
          "bytes": 1720752,
          "manifest": {
            "path": "manifest.json",
            "bytes": 27131,
            "sha256": "b196d0b851fa0f6b3b7972ab33b762898f3d577fbc26b6214542d6a5b10009af"
          },
          "validationReport": {
            "path": "validation-report.json",
            "bytes": 3515,
            "sha256": "13a82463853bc8fc6705cd9fb95a23647679bd5bc945a3f2358e243a7bd9c918",
            "result": "pass",
            "errors": 0
          },
          "seal": {
            "path": "seal.json",
            "bytes": 6805,
            "sha256": "fb0696a3f38509468076c4fff374106127e092f3b70b4c1536f7c611009dc855",
            "sealedFileCount": 35,
            "sealedBytes": 1713947,
            "sealedDigestSha256": "49c4272f2b48f311429575814bf23acef02bcd9f5e96033b2d618be88678a9e8"
          }
        },
        "zeroCopy": {
          "nativeRecordsReferenced": 519678,
          "nativeRecordsCopied": 0,
          "nativeViews": 17
        },
        "projection": {